{
  "kind": "franz-lola-level",
  "schemaVersion": 1,
  "id": "uni",
  "icon": "U",
  "name": {
    "standard": "Universität & Inn",
    "dialect": "Uni & Inn"
  },
  "description": {
    "standard": "Eine schnelle Runde am Innufer zwischen Campus, Promenade und neugierigen Nachbarskatzen.",
    "dialect": "A flotte Rundn am Innufer zwischen Campus, Promenad und neugierige Nochbarskatzn."
  },
  "mission": {
    "standard": "Am Inn entlang",
    "dialect": "Am Inn entlang"
  },
  "location": {
    "latitude": 48.5683,
    "longitude": 13.4533,
    "area": "INN · INNSTADT"
  },
  "board": {
    "columns": 25,
    "rows": 25,
    "tileSize": 24,
    "tunnelRows": [
      12
    ],
    "walls": [
      {
        "x": 2,
        "y": 2,
        "width": 3,
        "height": 5
      },
      {
        "x": 7,
        "y": 2,
        "width": 5,
        "height": 2
      },
      {
        "x": 14,
        "y": 2,
        "width": 4,
        "height": 3
      },
      {
        "x": 20,
        "y": 2,
        "width": 3,
        "height": 5
      },
      {
        "x": 7,
        "y": 6,
        "width": 3,
        "height": 4
      },
      {
        "x": 15,
        "y": 7,
        "width": 3,
        "height": 3
      },
      {
        "x": 2,
        "y": 9,
        "width": 3,
        "height": 3
      },
      {
        "x": 20,
        "y": 9,
        "width": 3,
        "height": 3
      },
      {
        "x": 6,
        "y": 12,
        "width": 3,
        "height": 2
      },
      {
        "x": 16,
        "y": 12,
        "width": 3,
        "height": 2
      },
      {
        "x": 2,
        "y": 15,
        "width": 3,
        "height": 4
      },
      {
        "x": 7,
        "y": 16,
        "width": 4,
        "height": 2
      },
      {
        "x": 14,
        "y": 16,
        "width": 4,
        "height": 2
      },
      {
        "x": 20,
        "y": 15,
        "width": 3,
        "height": 4
      },
      {
        "x": 2,
        "y": 21,
        "width": 5,
        "height": 2
      },
      {
        "x": 9,
        "y": 20,
        "width": 3,
        "height": 3
      },
      {
        "x": 14,
        "y": 20,
        "width": 3,
        "height": 3
      },
      {
        "x": 19,
        "y": 21,
        "width": 4,
        "height": 2
      }
    ]
  },
  "theme": {
    "id": "neighborhood",
    "landmark": "dog-park",
    "palette": {
      "ground": [
        "#20262d",
        "#222a31",
        "#1d242b",
        "#252d33"
      ],
      "curb": "#4d606c",
      "walls": [
        "#3b4855",
        "#485a68",
        "#3d4149",
        "#59636d"
      ],
      "water": "#3cae9d"
    }
  },
  "actors": {
    "player": {
      "x": 12,
      "y": 20,
      "renderer": "franz-lola",
      "animation": "",
      "appearance": null,
      "behavior": {
        "controller": "user",
        "speedMultiplier": 1
      }
    },
    "cats": [
      {
        "x": 11,
        "y": 12,
        "renderer": "cat",
        "animation": "",
        "color": "#ff6b5f",
        "accent": "#9e302e",
        "appearance": null,
        "behavior": {
          "strategy": "chase",
          "speedMultiplier": 1,
          "lookAhead": 0,
          "wanderMultiplier": 1,
          "wander": 0,
          "respawnDelay": 0,
          "target": {
            "x": 22,
            "y": 22
          }
        }
      },
      {
        "x": 12,
        "y": 12,
        "renderer": "cat",
        "animation": "",
        "color": "#f2a65a",
        "accent": "#a6532c",
        "appearance": null,
        "behavior": {
          "strategy": "ambush",
          "speedMultiplier": 1,
          "lookAhead": 3,
          "wanderMultiplier": 2,
          "wander": 0,
          "respawnDelay": 0.9,
          "target": {
            "x": 22,
            "y": 22
          }
        }
      },
      {
        "x": 13,
        "y": 12,
        "renderer": "cat",
        "animation": "",
        "color": "#b792e8",
        "accent": "#66509d",
        "appearance": null,
        "behavior": {
          "strategy": "scatter-chase",
          "speedMultiplier": 1,
          "lookAhead": 0,
          "wanderMultiplier": 3,
          "wander": 0,
          "respawnDelay": 1.8,
          "target": {
            "x": 22,
            "y": 22
          }
        }
      }
    ]
  },
  "collectibles": {
    "powerUps": [
      {
        "x": 1,
        "y": 1
      },
      {
        "x": 23,
        "y": 1
      },
      {
        "x": 1,
        "y": 23
      },
      {
        "x": 23,
        "y": 23
      }
    ]
  },
  "gameplay": {
    "pelletSeed": 485,
    "treatTargets": {
      "easy": 70,
      "normal": 110,
      "hard": 160
    },
    "difficulties": {
      "easy": {
        "playerSpeed": 5.8,
        "catSpeed": 2.55,
        "frightenedSpeed": 1.85,
        "catCount": 2,
        "lives": 5,
        "powerDuration": 12,
        "wander": 7.2,
        "grace": 2.2
      },
      "normal": {
        "playerSpeed": 5.55,
        "catSpeed": 3.35,
        "frightenedSpeed": 2.55,
        "catCount": 3,
        "lives": 3,
        "powerDuration": 9,
        "wander": 4.2,
        "grace": 1.6
      },
      "hard": {
        "playerSpeed": 5.35,
        "catSpeed": 4.05,
        "frightenedSpeed": 3.25,
        "catCount": 3,
        "lives": 2,
        "powerDuration": 7,
        "wander": 2.1,
        "grace": 1.1
      }
    }
  },
  "source": {
    "catalog": "Geburtstagsspiel",
    "gameLayout": 5,
    "markerClass": "",
    "home": false,
    "mapOrder": 5
  },
  "decorations": [],
  "events": []
}
